[
  {
    "id": "source-2014-0215-f1-al-qaeda-bin-laden",
    "date": "2001-01-20",
    "sortDate": "2001-01-20",
    "dateLine": "January 20, 2001-January 20, 2009",
    "type": "Source Collection",
    "title": "FOIA 2014-0215-F[1]: Records regarding al Qaeda and Osama bin Laden",
    "documentTitle": "Records Sent to, Sent by, or Received by President George W. Bush Regarding al Qaeda and Osama bin Laden",
    "chapter": {
      "number": 1,
      "name": "Policy Inheritance and Review"
    },
    "releaseStatus": "Released Finding Aid",
    "selectionDecision": "Source lead",
    "productionIssues": ["needs-selection", "needs-declass", "needs-annotation"],
    "source": {
      "repository": "George W. Bush Presidential Library",
      "collection": "FOIA 2014-0215-F[1]",
      "series": "White House Office of Records Management Subject Files and Staff Member Office Files",
      "caseNumber": "2014-0215-F[1]",
      "url": "https://www.georgewbushlibrary.gov/sites/default/files/2023-08/20140215f1-findingaid_0.pdf"
    },
    "pdfUrl": "https://www.georgewbushlibrary.gov/sites/default/files/2023-08/20140215f1-findingaid_0.pdf",
    "pageCount": 52,
    "sourceNote": "Source: George W. Bush Presidential Library, FOIA 2014-0215-F[1], Records Sent to, Sent by, or Received by President George W. Bush Regarding al Qaeda and Osama bin Laden, finding aid last modified August 30, 2023. The finding aid describes 1,296 folders and approximately 44,583 pages; item-level selection and declassification status require review in the released folders.",
    "sourceNoteStatus": "Draft",
    "summary": "Broad presidential-records finding aid for materials concerning Osama bin Laden and al Qaeda. It is a source collection lead rather than a single chronological document.",
    "editorialUse": "Use to identify folders, document IDs, and released pages that may contain direct presidential-level counterterrorism records for the pre-September 11 period.",
    "frusTopics": ["al Qaeda", "Osama bin Laden", "George W. Bush Library", "source collection"],
    "indexTerms": ["FOIA 2014-0215-F", "President George W. Bush", "Presidential Records Act"],
    "countries": ["United States", "Afghanistan"],
    "persons": ["George W. Bush", "Osama bin Laden"],
    "citedBy": ["George W. Bush Library finding aid"]
  },
  {
    "id": "source-2014-0487-f-nsc-minutes",
    "date": "2001-01-20",
    "sortDate": "2001-01-20",
    "dateLine": "January-December 2001",
    "type": "Source Collection",
    "title": "FOIA 2014-0487-F: Minutes of National Security Council meetings",
    "documentTitle": "Minutes of National Security Council Meetings from January 2001 to December 2001",
    "chapter": {
      "number": 1,
      "name": "Policy Inheritance and Review"
    },
    "releaseStatus": "Released Finding Aid",
    "selectionDecision": "Source lead",
    "productionIssues": ["needs-selection", "needs-declass", "needs-annotation"],
    "source": {
      "repository": "George W. Bush Presidential Library",
      "collection": "FOIA 2014-0487-F",
      "series": "National Security Council - Records and Access Management",
      "caseNumber": "2014-0487-F",
      "url": "https://www.georgewbushlibrary.gov/research/finding-aids/foia-requests/2014-0487-f-minutes-national-security-council-meetings-january-2001-december-2001"
    },
    "catalogUrl": "https://www.georgewbushlibrary.gov/research/finding-aids/foia-requests/2014-0487-f-minutes-national-security-council-meetings-january-2001-december-2001",
    "pageCount": 297,
    "sourceNote": "Source: George W. Bush Presidential Library, FOIA 2014-0487-F, Minutes of National Security Council Meetings from January 2001 to December 2001, National Security Council - Records and Access Management files. The finding aid describes 15 folders and approximately 297 pages, with many listed documents possibly closed for national-security classification or FOIA exemptions.",
    "sourceNoteStatus": "Draft",
    "summary": "Finding aid for NSC meeting records in 2001, including January 20 Middle East records and post-September 11 terrorism meetings. Useful as a source map even where pre-September 10 terrorism minutes are not publicly listed.",
    "editorialUse": "Use as a control source for NSC meeting folders and as a reminder to verify whether Deputies or Principals counterterrorism records are in adjacent NSC series.",
    "frusTopics": ["NSC meetings", "source collection", "counterterrorism"],
    "indexTerms": ["National Security Council", "FOIA 2014-0487-F", "Records and Access Management"],
    "countries": ["United States"],
    "persons": ["George W. Bush", "Condoleezza Rice"],
    "citedBy": ["George W. Bush Library finding aid"]
  },
  {
    "id": "source-state-foia-bin-ladin-afghanistan-2001",
    "date": "2001-01-20",
    "sortDate": "2001-01-20",
    "dateLine": "January 20-September 10, 2001",
    "type": "Source Collection",
    "title": "State FOIA Bin Ladin, Taliban, Afghanistan, and Pakistan release sets",
    "documentTitle": "Department of State FOIA Virtual Reading Room searches for Bin Ladin and related counterterrorism records",
    "chapter": {
      "number": 1,
      "name": "Policy Inheritance and Review"
    },
    "releaseStatus": "Mixed",
    "selectionDecision": "Source lead",
    "productionIssues": ["needs-selection", "needs-annotation", "needs-index"],
    "source": {
      "repository": "Department of State",
      "collection": "FOIA Virtual Reading Room",
      "series": "Released Documents Search",
      "itemTitle": "Bin Ladin search, document date range January 20-September 10, 2001",
      "url": "https://foia.state.gov/FOIALIBRARY/SearchResults.aspx"
    },
    "catalogUrl": "https://foia.state.gov/FOIALIBRARY/SearchResults.aspx",
    "sourceNote": "Source: Department of State FOIA Virtual Reading Room, released-document searches for Bin Ladin and related counterterrorism terms, document-date range January 20-September 10, 2001. The Bin Ladin search returned 54 hits, including case F-2010-03412, Bureau of Intelligence records related to Pakistani intelligence, the Taliban, al-Qaida, Afghanistan, or Osama bin Laden, and case F-2011-03409, records related to Usama Bin Ladin.",
    "sourceNoteStatus": "Draft",
    "summary": "Primary-source shelf for State Department cables, briefing memoranda, and INR assessments that intersect the pre-September 11 counterterrorism chronology.",
    "editorialUse": "Use as a control lead for State FOIA retrievals, especially released diplomatic cables on Taliban proposals, public warning cables, and INR Afghanistan assessments.",
    "frusTopics": ["State Department", "FOIA", "al Qaeda", "Osama bin Laden", "Afghanistan"],
    "indexTerms": ["Department of State FOIA", "F-2010-03412", "F-2011-03409", "Virtual Reading Room"],
    "countries": ["United States", "Afghanistan", "Pakistan", "Qatar"],
    "persons": ["Osama bin Laden"],
    "citedBy": ["Department of State FOIA Virtual Reading Room"]
  },
  {
    "id": "source-avalon-911-commission-report-2004-07",
    "date": "2001-01-20",
    "sortDate": "2001-01-20",
    "dateLine": "July 2004 report; source shelf for January 20-September 10, 2001 chronology",
    "type": "Source Collection",
    "title": "Avalon 9/11 Commission Report chronology and document leads",
    "documentTitle": "The 9/11 Commission Report",
    "chapter": {
      "number": 1,
      "name": "Policy Inheritance and Review"
    },
    "releaseStatus": "Public",
    "selectionDecision": "Source lead",
    "productionIssues": ["needs-selection", "needs-annotation", "needs-index"],
    "source": {
      "repository": "National Commission on Terrorist Attacks Upon the United States / Yale Law School Avalon Project",
      "collection": "The 9/11 Commission Report",
      "series": "Public report and notes",
      "itemTitle": "The 9/11 Commission Report",
      "url": "https://avalon.law.yale.edu/sept11/911report.pdf"
    },
    "catalogUrl": "https://avalon.law.yale.edu/sept11/911report.pdf",
    "pdfUrl": "https://avalon.law.yale.edu/sept11/911report.pdf",
    "transcriptionUrl": "reports/avalon-911-report-source-chronology.md",
    "pageCount": 585,
    "sourceNote": "Source: Yale Law School Avalon Project PDF copy of the National Commission on Terrorist Attacks Upon the United States, \"The 9/11 Commission Report,\" July 2004. Chapters 6.5, 7, and 8, with notes to chapters 6-8, identify a control chronology and primary source targets including NSC memoranda, Deputies and Principals meeting records, CIA briefing materials, State cables, FBI and FAA warnings, DOJ memoranda, and late Mihdhar/Hazmi/Moussaoui/KSM leads for January 20-September 10, 2001.",
    "sourceNoteStatus": "Draft",
    "summary": "Full-report source shelf and chronology map for the new administration's al Qaeda review, the summer 2001 warning spike, domestic and aviation leads, and the September 4-10 strategy decisions.",
    "editorialUse": "Use as a control index for extracting underlying 2001 documents; do not substitute the retrospective Commission narrative for contemporaneous NSC, CIA, State, FBI, FAA, DOJ, or White House records where those can be located.",
    "frusTopics": ["9/11 Commission", "source collection", "al Qaeda", "threat surge", "NSC", "CIA", "FBI", "State Department"],
    "indexTerms": ["Avalon Project", "The 9/11 Commission Report", "Counterterrorism Security Group", "Deputies Committee", "Principals Committee", "Predator", "Moussaoui", "Mihdhar", "Hazmi"],
    "countries": ["United States", "Afghanistan", "Pakistan", "Saudi Arabia"],
    "persons": ["George W. Bush", "Condoleezza Rice", "Richard A. Clarke", "George Tenet", "Stephen Hadley", "John Ashcroft", "Osama bin Laden", "Zacarias Moussaoui", "Khalid al-Mihdhar", "Nawaf al-Hazmi"],
    "citedBy": ["Yale Law School Avalon Project", "9/11 Commission Report"],